site,name,altName,address,observationYear,comment,wikiUA,newsLink,wkt,longitude,latitude,oblast,coordinate_p625,wikidata_id,wikidata_label,instance_of,instance_of_label,distance_km,method,match_score
https://linked4resilience.eu/data/cultural-sites/00001,Historic building of the regional youth center (formerly the Shchors Cinema),Чернігівський обласний молодіжний центр,"Mahistrats'ka St, 3, Chernihiv, Chernihiv Oblast, Ukraine, 14000",2022-02-27,formerly the Shchors Cinema,https://uk.wikipedia.org/wiki/%D0%91%D1%83%D0%B4%D0%B8%D0%BD%D0%BE%D0%BA_%D0%A7%D0%B5%D1%80%D0%BD%D1%96%D0%B3%D1%96%D0%B2%D1%81%D1%8C%D0%BA%D0%BE%D0%B3%D0%BE_%D0%BE%D0%B1%D0%BB%D0%B0%D1%81%D0%BD%D0%BE%D0%B3%D0%BE_%D0%BC%D0%BE%D0%BB%D0%BE%D0%B4%D1%96%D0%B6%D0%BD%D0%BE%D0%B3%D0%BE_%D1%86%D0%B5%D0%BD%D1%82%D1%80%D1%83,,Point (31.2971075157 51.4929202781),31.2971075157,51.4929202781,Chernihiv Oblast,"51.4929202781,31.2971075157",Q110319282,Будинок Чернігівського обласного молодіжного центру,Q41176,будівля,0.20148675362703017,wikipedia,160
https://linked4resilience.eu/data/cultural-sites/00001,Historic building of the regional youth center (formerly the Shchors Cinema),Чернігівський обласний молодіжний центр,"Mahistrats'ka St, 3, Chernihiv, Chernihiv Oblast, Ukraine, 14000",2022-02-27,"partially destroyed as a result of an air strike on the building of the Chernihiv City Council (State Bank House) on February 27, 2022",https://uk.wikipedia.org/wiki/%D0%91%D1%83%D0%B4%D0%B8%D0%BD%D0%BE%D0%BA_%D0%A7%D0%B5%D1%80%D0%BD%D1%96%D0%B3%D1%96%D0%B2%D1%81%D1%8C%D0%BA%D0%BE%D0%B3%D0%BE_%D0%BE%D0%B1%D0%BB%D0%B0%D1%81%D0%BD%D0%BE%D0%B3%D0%BE_%D0%BC%D0%BE%D0%BB%D0%BE%D0%B4%D1%96%D0%B6%D0%BD%D0%BE%D0%B3%D0%BE_%D1%86%D0%B5%D0%BD%D1%82%D1%80%D1%83,,Point (31.2971075157 51.4929202781),31.2971075157,51.4929202781,Chernihiv Oblast,"51.4929202781,31.2971075157",Q110319282,Будинок Чернігівського обласного молодіжного центру,Q41176,будівля,0.20148675362703017,wikipedia,160
https://linked4resilience.eu/data/cultural-sites/00002,Church of St. Theodosius,Church of St.Theodosius,"Yatsevo Cemetery (next to the entrance), Chernihiv, Chernihiv Oblast, Ukraine, 14000",2022-03-13,The first church in Chernihiv. Was partially destroyed by shelling and fire during the fight for Chernihiv,https://uk.wikipedia.org/wiki/%D0%A6%D0%B5%D1%80%D0%BA%D0%B2%D0%B0_%D1%81%D0%B2%D1%8F%D1%82%D0%B8%D1%82%D0%B5%D0%BB%D1%8F_%D0%A4%D0%B5%D0%BE%D0%B4%D0%BE%D1%81%D1%96%D1%8F_(%D0%A7%D0%B5%D1%80%D0%BD%D1%96%D0%B3%D1%96%D0%B2),,Point (31.3653939 51.5333489),31.3653939,51.5333489,Chernihiv Oblast,"51.5333489,31.3653939",Q16722594,Церква Святого Феодосія Углицького,Q16970,церква,0.17647631165215294,wikipedia,160
https://linked4resilience.eu/data/cultural-sites/00002,Church of St. Theodosius,Церква святителя Феодосія,"Yatsevo Cemetery (next to the entrance), Chernihiv, Chernihiv Oblast, Ukraine, 14000",2022-03-13,The first church in Chernihiv. Was partially destroyed by shelling and fire during the fight for Chernihiv,https://uk.wikipedia.org/wiki/%D0%A6%D0%B5%D1%80%D0%BA%D0%B2%D0%B0_%D1%81%D0%B2%D1%8F%D1%82%D0%B8%D1%82%D0%B5%D0%BB%D1%8F_%D0%A4%D0%B5%D0%BE%D0%B4%D0%BE%D1%81%D1%96%D1%8F_(%D0%A7%D0%B5%D1%80%D0%BD%D1%96%D0%B3%D1%96%D0%B2),,Point (31.3653939 51.5333489),31.3653939,51.5333489,Chernihiv Oblast,"51.5333489,31.3653939",Q16722594,Церква Святого Феодосія Углицького,Q16970,церква,0.17647631165215294,wikipedia,160
https://linked4resilience.eu/data/cultural-sites/00003,The Military Historical Museum - a branch of the Chernihiv Historical Museum – Chernihiv,,"55A, Shevchenka St 55А Чернигов Чернігівська, 14013, Shevchenka Street, 55А, Chernihiv, Chernihiv Oblast, Ukraine, 14000",2022-03-13,Chernihiv Historical Museum of V.V. Tarnovsky,https://uk.wikipedia.org/wiki/%D0%A7%D0%B5%D1%80%D0%BD%D1%96%D0%B3%D1%96%D0%B2%D1%81%D1%8C%D0%BA%D0%B8%D0%B9_%D0%B2%D1%96%D0%B9%D1%81%D1%8C%D0%BA%D0%BE%D0%B2%D0%BE-%D1%96%D1%81%D1%82%D0%BE%D1%80%D0%B8%D1%87%D0%BD%D0%B8%D0%B9_%D0%BC%D1%83%D0%B7%D0%B5%D0%B9,,Point (31.3190685394 51.4980378259),31.3190685394,51.4980378259,Chernihiv Oblast,"51.4980378259,31.3190685394",Q110259708,Чернігівський військово-історичний музей,Q33506,музей,0.03147696154824075,wikipedia,180
https://linked4resilience.eu/data/cultural-sites/00003,The Military Historical Museum - a branch of the Chernihiv Historical Museum – Chernihiv,,"55A, Shevchenka St 55А Чернигов Чернігівська, 14013, Shevchenka Street, 55А, Chernihiv, Chernihiv Oblast, Ukraine, 14000",2022-03-13,The Military Historical Museum - a branch of the Chernihiv Historical Museum – Chernihiv,https://uk.wikipedia.org/wiki/%D0%A7%D0%B5%D1%80%D0%BD%D1%96%D0%B3%D1%96%D0%B2%D1%81%D1%8C%D0%BA%D0%B8%D0%B9_%D0%B2%D1%96%D0%B9%D1%81%D1%8C%D0%BA%D0%BE%D0%B2%D0%BE-%D1%96%D1%81%D1%82%D0%BE%D1%80%D0%B8%D1%87%D0%BD%D0%B8%D0%B9_%D0%BC%D1%83%D0%B7%D0%B5%D0%B9,,Point (31.3190685394 51.4980378259),31.3190685394,51.4980378259,Chernihiv Oblast,"51.4980378259,31.3190685394",Q110259708,Чернігівський військово-історичний музей,Q33506,музей,0.03147696154824075,wikipedia,180
https://linked4resilience.eu/data/cultural-sites/00004,Chernihiv regional library for Youth,Chernihiv oblast children's library,"Shevchenka Street, 63, Chernihiv, Chernihiv Oblast, Ukraine, 14039",2022-03-11,Chernihiv regional library for Youth. It was formerly known as Vasyl Tarnovsky Museum of Ukrainian Antiquities.,,,Point (31.3254843411 51.5028060067),31.3254843411,51.5028060067,Chernihiv Oblast,"51.5028060067,31.3254843411",Q108616681,Музей українських старожитностей,Q207694,художня галерея,0.0606016021304567,coords,150
https://linked4resilience.eu/data/cultural-sites/00004,Chernihiv regional library for Youth,Дитяча бібліотека в Чернігові,"Shevchenka Street, 63, Chernihiv, Chernihiv Oblast, Ukraine, 14039",2022-03-11,Chernihiv regional library for Youth. It was formerly known as Vasyl Tarnovsky Museum of Ukrainian Antiquities.,,,Point (31.3254843411 51.5028060067),31.3254843411,51.5028060067,Chernihiv Oblast,"51.5028060067,31.3254843411",,,,,,none,
https://linked4resilience.eu/data/cultural-sites/00005,St. Catherine Church of Chernihiv,St. Catherine's Cathedral,"Pidval'na St, 5, Chernihiv, Chernihiv Oblast, Ukraine, 14000",2022-03,Is it St. Catherine Church or Catherine Church?,https://uk.wikipedia.org/wiki/%D0%9A%D0%B0%D1%82%D0%B5%D1%80%D0%B8%D0%BD%D0%B8%D0%BD%D1%81%D1%8C%D0%BA%D0%B0_%D1%86%D0%B5%D1%80%D0%BA%D0%B2%D0%B0_(%D0%A7%D0%B5%D1%80%D0%BD%D1%96%D0%B3%D1%96%D0%B2),,Point (31.3055123278 51.487314051),31.3055123278,51.487314051,Chernihiv Oblast,"51.487314051,31.3055123278",Q12138312,Пам'ятний камінь «Борцям за волю України» (Чернігів),Q4989906,пам'ятник,0.09033384453338109,coords,150
https://linked4resilience.eu/data/cultural-sites/00005,St. Catherine Church of Chernihiv,Катерининська церква ПЦУ,"Pidval'na St, 5, Chernihiv, Chernihiv Oblast, Ukraine, 14000",2022-03,Is it St. Catherine Church or Catherine Church?,https://uk.wikipedia.org/wiki/%D0%9A%D0%B0%D1%82%D0%B5%D1%80%D0%B8%D0%BD%D0%B8%D0%BD%D1%81%D1%8C%D0%BA%D0%B0_%D1%86%D0%B5%D1%80%D0%BA%D0%B2%D0%B0_(%D0%A7%D0%B5%D1%80%D0%BD%D1%96%D0%B3%D1%96%D0%B2),,Point (31.3055123278 51.487314051),31.3055123278,51.487314051,Chernihiv Oblast,"51.487314051,31.3055123278",Q12138312,Пам'ятний камінь «Борцям за волю України» (Чернігів),Q4989906,пам'ятник,0.09033384453338109,coords,150
https://linked4resilience.eu/data/cultural-sites/00006,Chernihiv Regional Universal Scientific Library. V.G. Korolenko,Korolenko Chernihiv Regional Universal Scientific Library,"Myru Ave, 41, Chernihiv, Chernihiv Oblast, Ukraine, 14000",2022-03-30,,https://uk.wikipedia.org/wiki/%D0%A7%D0%B5%D1%80%D0%BD%D1%96%D0%B3%D1%96%D0%B2%D1%81%D1%8C%D0%BA%D0%B0_%D0%BE%D0%B1%D0%BB%D0%B0%D1%81%D0%BD%D0%B0_%D1%83%D0%BD%D1%96%D0%B2%D0%B5%D1%80%D1%81%D0%B0%D0%BB%D1%8C%D0%BD%D0%B0_%D0%BD%D0%B0%D1%83%D0%BA%D0%BE%D0%B2%D0%B0_%D0%B1%D1%96%D0%B1%D0%BB%D1%96%D0%BE%D1%82%D0%B5%D0%BA%D0%B0_%D1%96%D0%BC%D0%B5%D0%BD%D1%96_%D0%92._%D0%93._%D0%9A%D0%BE%D1%80%D0%BE%D0%BB%D0%B5%D0%BD%D0%BA%D0%B0,,Point (31.2919389271 51.4967301207),31.2919389271,51.4967301207,Chernihiv Oblast,"51.4967301207,31.2919389271",Q16694982,Воскресенська церква,Q16970,церква,0.4354298670192628,coords,130
https://linked4resilience.eu/data/cultural-sites/00006,Chernihiv Regional Universal Scientific Library. V.G. Korolenko,Чернігівська обласна універсальна наукова бібліотека імені Софії та Олександра Русових,"Myru Ave, 41, Chernihiv, Chernihiv Oblast, Ukraine, 14000",2022-03-30,,https://uk.wikipedia.org/wiki/%D0%A7%D0%B5%D1%80%D0%BD%D1%96%D0%B3%D1%96%D0%B2%D1%81%D1%8C%D0%BA%D0%B0_%D0%BE%D0%B1%D0%BB%D0%B0%D1%81%D0%BD%D0%B0_%D1%83%D0%BD%D1%96%D0%B2%D0%B5%D1%80%D1%81%D0%B0%D0%BB%D1%8C%D0%BD%D0%B0_%D0%BD%D0%B0%D1%83%D0%BA%D0%BE%D0%B2%D0%B0_%D0%B1%D1%96%D0%B1%D0%BB%D1%96%D0%BE%D1%82%D0%B5%D0%BA%D0%B0_%D1%96%D0%BC%D0%B5%D0%BD%D1%96_%D0%92._%D0%93._%D0%9A%D0%BE%D1%80%D0%BE%D0%BB%D0%B5%D0%BD%D0%BA%D0%B0,,Point (31.2919389271 51.4967301207),31.2919389271,51.4967301207,Chernihiv Oblast,"51.4967301207,31.2919389271",Q16694982,Воскресенська церква,Q16970,церква,0.4354298670192628,coords,130
https://linked4resilience.eu/data/cultural-sites/00007,St. Kazan Church,Tserkva Kazansʹkoyi Ikony Bozhoyi Materi,"Kotsyubyns'koho St, 5, Chernihiv, Chernihiv Oblast, Ukraine, 14000",2022-03-07,,https://uk.wikipedia.org/wiki/%D0%A1%D0%B2%D1%8F%D1%82%D0%BE-%D0%9A%D0%B0%D0%B7%D0%B0%D0%BD%D1%81%D1%8C%D0%BA%D0%B0_%D1%86%D0%B5%D1%80%D0%BA%D0%B2%D0%B0_(%D0%A7%D0%B5%D1%80%D0%BD%D1%96%D0%B3%D1%96%D0%B2),,Point (31.2881894848 51.4877821497),31.2881894848,51.4877821497,Chernihiv Oblast,"51.4877821497,31.2881894848",Q12107631,Церква Казанської ікони Божої Матері,Q16970,церква,0.019782187050449287,wikipedia,180
https://linked4resilience.eu/data/cultural-sites/00007,St. Kazan Church,Церква Казанської ікони Божої Матері,"Kotsyubyns'koho St, 5, Chernihiv, Chernihiv Oblast, Ukraine, 14000",2022-03-07,,https://uk.wikipedia.org/wiki/%D0%A1%D0%B2%D1%8F%D1%82%D0%BE-%D0%9A%D0%B0%D0%B7%D0%B0%D0%BD%D1%81%D1%8C%D0%BA%D0%B0_%D1%86%D0%B5%D1%80%D0%BA%D0%B2%D0%B0_(%D0%A7%D0%B5%D1%80%D0%BD%D1%96%D0%B3%D1%96%D0%B2),,Point (31.2881894848 51.4877821497),31.2881894848,51.4877821497,Chernihiv Oblast,"51.4877821497,31.2881894848",Q12107631,Церква Казанської ікони Божої Матері,Q16970,церква,0.019782187050449287,wikipedia,180
https://linked4resilience.eu/data/cultural-sites/00008,"Voskresenska Church, Lukashivka",Voznesensʹka Tserkva,"Lukashivka, Chernihiv Oblast, Ukraine, 15560",2022-03,,,,Point (31.3912379136 51.3858078276),31.3912379136,51.3858078276,Chernihiv Oblast,"51.3858078276,31.3912379136",,,,,,none,
https://linked4resilience.eu/data/cultural-sites/00008,"Voskresenska Church, Lukashivka",Вознесенська церква,"Lukashivka, Chernihiv Oblast, Ukraine, 15560",2022-03,,,,Point (31.3912379136 51.3858078276),31.3912379136,51.3858078276,Chernihiv Oblast,"51.3858078276,31.3912379136",Q20074713,Вознесенська церква,Q16970,церква,0.012962932737802883,coords,150
https://linked4resilience.eu/data/cultural-sites/00009,Central City Library M. Kotsiubynsky,Chernihivsʹka Tsentralʹna Misʹka Biblioteka Imeni M. M. Kotsyubynsʹkoho,"Kyrponosa St, 22, Chernihiv, Chernihiv Oblast, Ukraine, 14000",2022-02-27,,https://uk.wikipedia.org/wiki/%D0%A7%D0%B5%D1%80%D0%BD%D1%96%D0%B3%D1%96%D0%B2%D1%81%D1%8C%D0%BA%D0%B0_%D1%86%D0%B5%D0%BD%D1%82%D1%80%D0%B0%D0%BB%D1%8C%D0%BD%D0%B0_%D0%BC%D1%96%D1%81%D1%8C%D0%BA%D0%B0_%D0%B1%D1%96%D0%B1%D0%BB%D1%96%D0%BE%D1%82%D0%B5%D0%BA%D0%B0_%D1%96%D0%BC%D0%B5%D0%BD%D1%96_%D0%9C._%D0%9C._%D0%9A%D0%BE%D1%86%D1%8E%D0%B1%D0%B8%D0%BD%D1%81%D1%8C%D0%BA%D0%BE%D0%B3%D0%BE,,Point (31.2941989867 51.4912992961),31.2941989867,51.4912992961,Chernihiv Oblast,"51.4912992961,31.2941989867",Q2082248,П'ятницька церква,Q2031836,православний храм,0.47610964566588737,coords,130
https://linked4resilience.eu/data/cultural-sites/00009,Central City Library M. Kotsiubynsky,Чернігівська центральна міська бібліотека імені М. Коцюбинського,"Kyrponosa St, 22, Chernihiv, Chernihiv Oblast, Ukraine, 14000",2022-02-27,,https://uk.wikipedia.org/wiki/%D0%A7%D0%B5%D1%80%D0%BD%D1%96%D0%B3%D1%96%D0%B2%D1%81%D1%8C%D0%BA%D0%B0_%D1%86%D0%B5%D0%BD%D1%82%D1%80%D0%B0%D0%BB%D1%8C%D0%BD%D0%B0_%D0%BC%D1%96%D1%81%D1%8C%D0%BA%D0%B0_%D0%B1%D1%96%D0%B1%D0%BB%D1%96%D0%BE%D1%82%D0%B5%D0%BA%D0%B0_%D1%96%D0%BC%D0%B5%D0%BD%D1%96_%D0%9C._%D0%9C._%D0%9A%D0%BE%D1%86%D1%8E%D0%B1%D0%B8%D0%BD%D1%81%D1%8C%D0%BA%D0%BE%D0%B3%D0%BE,,Point (31.2941989867 51.4912992961),31.2941989867,51.4912992961,Chernihiv Oblast,"51.4912992961,31.2941989867",Q2082248,П'ятницька церква,Q2031836,православний храм,0.47610964566588737,coords,130
https://linked4resilience.eu/data/cultural-sites/00010,Chernihiv Regional Art Museum,Chernihiv Regional Art Museum,"Muzeina St, 6, Chernihiv, Chernihiv Oblast, Ukraine, 14006",2022-03-06,,https://uk.wikipedia.org/wiki/%D0%A7%D0%B5%D1%80%D0%BD%D1%96%D0%B3%D1%96%D0%B2%D1%81%D1%8C%D0%BA%D0%B8%D0%B9_%D0%BE%D0%B1%D0%BB%D0%B0%D1%81%D0%BD%D0%B8%D0%B9_%D1%85%D1%83%D0%B4%D0%BE%D0%B6%D0%BD%D1%96%D0%B9_%D0%BC%D1%83%D0%B7%D0%B5%D0%B9_%D1%96%D0%BC%D0%B5%D0%BD%D1%96_%D0%93%D1%80%D0%B8%D0%B3%D0%BE%D1%80%D1%96%D1%8F_%D0%93%D0%B0%D0%BB%D0%B0%D0%B3%D0%B0%D0%BD%D0%B0,,Point (31.3099137118 51.4914424453),31.3099137118,51.4914424453,Chernihiv Oblast,"51.4914424453,31.3099137118",Q4513550,Чернігівський обласний художній музей,Q2319498,пам’ятка архітектури,0.1375057758478491,wikipedia,110
https://linked4resilience.eu/data/cultural-sites/00011,House of Culture – Ivanivka,Ivanovo Central Cultural Center,"Druzhby St, 33A, Ivanivka, Chernihiv Oblast, 15562",2022-05,The Wikipedia page said it is in Ivanovo.,,,Point (31.2917023668 51.3768158802),31.2917023668,51.3768158802,Chernihiv Oblast,"51.3768158802,31.2917023668",Q4196501,Іванівка,Q21672098,село України,0.7776360302775461,coords,60
https://linked4resilience.eu/data/cultural-sites/00011,House of Culture – Ivanivka,Іванівський центральний будинок культури,"Druzhby St, 33A, Ivanivka, Chernihiv Oblast, 15562",2022-05,The Wikipedia page said it is in Ivanovo.,,,Point (31.2917023668 51.3768158802),31.2917023668,51.3768158802,Chernihiv Oblast,"51.3768158802,31.2917023668",Q4196501,Іванівка,Q21672098,село України,0.7776360302775461,coords,60
https://linked4resilience.eu/data/cultural-sites/00012,Memorial house-museum and estate of Mykhailo Kotsiubynskyi – Chernihiv,Chernihivsʹkyy Literaturno-Memorialʹnyy Muzey-Zapovidnyk Mykhayla Kotsyubynsʹkoho,"Kotsyubyns'koho St, 3, Chernihiv, Chernihiv Oblast, 14000",2022-03-06,,https://uk.wikipedia.org/wiki/%D0%A7%D0%B5%D1%80%D0%BD%D1%96%D0%B3%D1%96%D0%B2%D1%81%D1%8C%D0%BA%D0%B8%D0%B9_%D0%BB%D1%96%D1%82%D0%B5%D1%80%D0%B0%D1%82%D1%83%D1%80%D0%BD%D0%BE-%D0%BC%D0%B5%D0%BC%D0%BE%D1%80%D1%96%D0%B0%D0%BB%D1%8C%D0%BD%D0%B8%D0%B9_%D0%BC%D1%83%D0%B7%D0%B5%D0%B9-%D0%B7%D0%B0%D0%BF%D0%BE%D0%B2%D1%96%D0%B4%D0%BD%D0%B8%D0%BA_%D0%9C._%D0%9C._%D0%9A%D0%BE%D1%86%D1%8E%D0%B1%D0%B8%D0%BD%D1%81%D1%8C%D0%BA%D0%BE%D0%B3%D0%BE,,Point (31.287985594 51.487359224),31.287985594,51.487359224,Chernihiv Oblast,"51.487359224,31.287985594",Q4513543,Чернігівський літературно-меморіальний музей-заповідник Михайла Коцюбинського,Q33506,музей,0.04536677167835968,coords,150
https://linked4resilience.eu/data/cultural-sites/00012,Memorial house-museum and estate of Mykhailo Kotsiubynskyi – Chernihiv,Чернігівський літературно-меморіальний музей-заповідник Михайла Коцюбинського,"Kotsyubyns'koho St, 3, Chernihiv, Chernihiv Oblast, 14000",2022-03-06,,https://uk.wikipedia.org/wiki/%D0%A7%D0%B5%D1%80%D0%BD%D1%96%D0%B3%D1%96%D0%B2%D1%81%D1%8C%D0%BA%D0%B8%D0%B9_%D0%BB%D1%96%D1%82%D0%B5%D1%80%D0%B0%D1%82%D1%83%D1%80%D0%BD%D0%BE-%D0%BC%D0%B5%D0%BC%D0%BE%D1%80%D1%96%D0%B0%D0%BB%D1%8C%D0%BD%D0%B8%D0%B9_%D0%BC%D1%83%D0%B7%D0%B5%D0%B9-%D0%B7%D0%B0%D0%BF%D0%BE%D0%B2%D1%96%D0%B4%D0%BD%D0%B8%D0%BA_%D0%9C._%D0%9C._%D0%9A%D0%BE%D1%86%D1%8E%D0%B1%D0%B8%D0%BD%D1%81%D1%8C%D0%BA%D0%BE%D0%B3%D0%BE,,Point (31.287985594 51.487359224),31.287985594,51.487359224,Chernihiv Oblast,"51.487359224,31.287985594",Q4513543,Чернігівський літературно-меморіальний музей-заповідник Михайла Коцюбинського,Q33506,музей,0.04536677167835968,coords,150
https://linked4resilience.eu/data/cultural-sites/00013,House of Prayer of the Second Chernihiv Church of Christian Baptists – Chernihiv,House of Prayer,"Vsevoloda Hantsova St, 43, Chernihiv, Chernihiv Oblast, 14000",2022-03-09,,"https://uk.religiononfire.mar.in.ua/wiki/%D0%94%D1%96%D0%BC_%D0%BC%D0%BE%D0%BB%D0%B8%D1%82%D0%B2%D0%B8_%D0%94%D1%80%D1%83%D0%B3%D0%BE%D1%97_%D1%87%D0%B5%D1%80%D0%BD%D1%96%D0%B3%D1%96%D0%B2%D1%81%D1%8C%D0%BA%D0%BE%D1%97_%D1%86%D0%B5%D1%80%D0%BA%D0%B2%D0%B8,_%D0%BC._%D0%A7%D0%B5%D1%80%D0%BD%D1%96%D0%B3%D1%96%D0%B2,_%D0%A7%D0%B5%D1%80%D0%BD%D1%96%D0%B3%D1%96%D0%B2%D1%81%D1%8C%D0%BA%D0%B0_%D0%BE%D0%B1%D0%BB%D0%B0%D1%81%D1%82%D1%8C",,Point (31.3360634467 51.5174249173),31.3360634467,51.5174249173,Chernihiv Oblast,"51.5174249173,31.3360634467",Q12167799,Храм усіх святих Чернігівських,Q16970,церква,0.8305557656022559,coords,110
https://linked4resilience.eu/data/cultural-sites/00013,House of Prayer of the Second Chernihiv Church of Christian Baptists – Chernihiv,Дім Молитви,"Vsevoloda Hantsova St, 43, Chernihiv, Chernihiv Oblast, 14000",2022-03-09,,"https://uk.religiononfire.mar.in.ua/wiki/%D0%94%D1%96%D0%BC_%D0%BC%D0%BE%D0%BB%D0%B8%D1%82%D0%B2%D0%B8_%D0%94%D1%80%D1%83%D0%B3%D0%BE%D1%97_%D1%87%D0%B5%D1%80%D0%BD%D1%96%D0%B3%D1%96%D0%B2%D1%81%D1%8C%D0%BA%D0%BE%D1%97_%D1%86%D0%B5%D1%80%D0%BA%D0%B2%D0%B8,_%D0%BC._%D0%A7%D0%B5%D1%80%D0%BD%D1%96%D0%B3%D1%96%D0%B2,_%D0%A7%D0%B5%D1%80%D0%BD%D1%96%D0%B3%D1%96%D0%B2%D1%81%D1%8C%D0%BA%D0%B0_%D0%BE%D0%B1%D0%BB%D0%B0%D1%81%D1%82%D1%8C",,Point (31.3360634467 51.5174249173),31.3360634467,51.5174249173,Chernihiv Oblast,"51.5174249173,31.3360634467",,,,,,none,
https://linked4resilience.eu/data/cultural-sites/00014,Chernihiv Regional Taras Shevchenko Theater,Taras Shevchenko Chernihiv Regional Academic Music and Drama Theatre,"Myru Ave, 23, Chernihiv, Chernihiv Oblast, Ukraine, 14000",2023-08-19,,,https://war.ukraine.ua/crimes/chernihiv-theater-attack-on-august-19/,Point (31.2994653406 51.4915954136),31.2994653406,51.4915954136,Chernihiv Oblast,"51.4915954136,31.2994653406",Q4238143,Красна площа,Q174782,майдан,0.08627127241978616,coords,150
https://linked4resilience.eu/data/cultural-sites/00014,Chernihiv Regional Taras Shevchenko Theater,Чернігівський обласний академічний український музично-драматичний театр імені Т. Г. Шевченка,"Myru Ave, 23, Chernihiv, Chernihiv Oblast, Ukraine, 14000",2023-08-19,,,https://war.ukraine.ua/crimes/chernihiv-theater-attack-on-august-19/,Point (31.2994653406 51.4915954136),31.2994653406,51.4915954136,Chernihiv Oblast,"51.4915954136,31.2994653406",Q4238143,Красна площа,Q174782,майдан,0.08627127241978616,coords,150
https://linked4resilience.eu/data/cultural-sites/00015,The building of the “Desna” Hotel (architectural monument of local importance),,"Mahistrats'ka St, 1/20, Chernihiv, Chernihivs'ka oblast, 14000",2023-08-19,,"https://uk.wikipedia.org/wiki/%D0%91%D1%83%D0%B4%D0%B8%D0%BD%D0%BE%D0%BA_%D0%B3%D0%BE%D1%82%D0%B5%D0%BB%D1%8E_%C2%AB%D0%94%D0%B5%D1%81%D0%BD%D0%B0%C2%BB
",,Point (31.2973157116 51.4919700456),31.2973157116,51.4919700456,Chernihivs'ka oblast,"51.4919700456,31.2973157116",Q2082248,П'ятницька церква,Q2031836,православний храм,0.24831858463598128,coords,130
https://linked4resilience.eu/data/cultural-sites/00016,The house in which the writer H. Uspenskyi lived (architectural monument of local importance) – Chernihiv,,"Княжа вулиця (Кірпоноса), 20А",2022,,,https://siver.com.ua/news/chernigiv_rosijani_vdarili_po_ditjachij_stomatpoliklinici/2022-02-27-30498,Point (31.2958199683 51.4942239037),31.2958199683,51.4942239037,,"51.4942239037,31.2958199683",Q2082248,П'ятницька церква,Q2031836,православний храм,0.3944760969918166,coords,130
https://linked4resilience.eu/data/cultural-sites/00017,Ivankiv Museum,Ivankivsʹkyy Rayonnyy Istoryko-Krayeznavchyy Muzey,"Vulytsya Shevchenka, 15, Ivankiv, Kyiv Oblast, Ukraine, 07203",2022-02-25,,https://uk.m.wikipedia.org/wiki/%D0%86%D0%B2%D0%B0%D0%BD%D0%BA%D1%96%D0%B2%D1%81%D1%8C%D0%BA%D0%B8%D0%B9_%D1%96%D1%81%D1%82%D0%BE%D1%80%D0%B8%D0%BA%D0%BE-%D0%BA%D1%80%D0%B0%D1%94%D0%B7%D0%BD%D0%B0%D0%B2%D1%87%D0%B8%D0%B9_%D0%BC%D1%83%D0%B7%D0%B5%D0%B9,,Point (29.9052988848 50.9296394354),29.9052988848,50.9296394354,Kyiv Oblast,"50.9296394354,29.9052988848",Q111032466,Іванківський історико-краєзнавчий музей,Q33506,музей,0.052853588465990094,wikipedia,180
https://linked4resilience.eu/data/cultural-sites/00017,Ivankiv Museum,Іванківський районний історико-краєзнавчий музей,"Vulytsya Shevchenka, 15, Ivankiv, Kyiv Oblast, Ukraine, 07203",2022-02-25,,https://uk.m.wikipedia.org/wiki/%D0%86%D0%B2%D0%B0%D0%BD%D0%BA%D1%96%D0%B2%D1%81%D1%8C%D0%BA%D0%B8%D0%B9_%D1%96%D1%81%D1%82%D0%BE%D1%80%D0%B8%D0%BA%D0%BE-%D0%BA%D1%80%D0%B0%D1%94%D0%B7%D0%BD%D0%B0%D0%B2%D1%87%D0%B8%D0%B9_%D0%BC%D1%83%D0%B7%D0%B5%D0%B9,,Point (29.9052988848 50.9296394354),29.9052988848,50.9296394354,Kyiv Oblast,"50.9296394354,29.9052988848",Q111032466,Іванківський історико-краєзнавчий музей,Q33506,музей,0.052853588465990094,wikipedia,180
https://linked4resilience.eu/data/cultural-sites/00018,"Voznesens'ka Tserkva, Church of the Ascension",Church of the Ascension,"Luk'yanivka, Kyiv Oblast, 07511",2022-03-25,,https://uk.m.wikipedia.org/wiki/%D0%A5%D1%80%D0%B0%D0%BC_%D0%92%D0%BE%D0%B7%D0%BD%D0%B5%D1%81%D1%96%D0%BD%D0%BD%D1%8F_%D0%93%D0%BE%D1%81%D0%BF%D0%BE%D0%B4%D0%BD%D1%8C%D0%BE%D0%B3%D0%BE_(%D0%9B%D1%83%D0%BA%27%D1%8F%D0%BD%D1%96%D0%B2%D0%BA%D0%B0),,Point (31.4609500716 50.5135012964),31.4609500716,50.5135012964,Kyiv Oblast,"50.5135012964,31.4609500716",Q16694745,Церква Вознесіння Господнього,Q16970,церква,6.425918001440033,wikipedia,80
https://linked4resilience.eu/data/cultural-sites/00018,"Voznesens'ka Tserkva, Church of the Ascension",Свято-Вознесенська церква,"Luk'yanivka, Kyiv Oblast, 07511",2022-03-25,,https://uk.m.wikipedia.org/wiki/%D0%A5%D1%80%D0%B0%D0%BC_%D0%92%D0%BE%D0%B7%D0%BD%D0%B5%D1%81%D1%96%D0%BD%D0%BD%D1%8F_%D0%93%D0%BE%D1%81%D0%BF%D0%BE%D0%B4%D0%BD%D1%8C%D0%BE%D0%B3%D0%BE_(%D0%9B%D1%83%D0%BA%27%D1%8F%D0%BD%D1%96%D0%B2%D0%BA%D0%B0),,Point (31.4609500716 50.5135012964),31.4609500716,50.5135012964,Kyiv Oblast,"50.5135012964,31.4609500716",Q16694745,Церква Вознесіння Господнього,Q16970,церква,6.425918001440033,wikipedia,80
https://linked4resilience.eu/data/cultural-sites/00019,Old church (Tserkva Heorhiyivsʹka) in Zavorychi village of Kyiv region,St. George's Church,"Kirova 57, Zavorychi, Brovary Raion, Kyiv Oblast, Ukraine.",2022-03-07,,https://uk.wikipedia.org/wiki/%D0%93%D0%B5%D0%BE%D1%80%D0%B3%D1%96%D1%97%D0%B2%D1%81%D1%8C%D0%BA%D0%B0_%D1%86%D0%B5%D1%80%D0%BA%D0%B2%D0%B0_(%D0%97%D0%B0%D0%B2%D0%BE%D1%80%D0%B8%D1%87%D1%96),https://ui.org.ua/postcard/st-georges-church/,Point (31.1509406217 50.7042498289),31.1509406217,50.7042498289,Kyiv Oblast,"50.7042498289,31.1509406217",Q111146564,Георгіївська церква (Заворичі),Q16970,церква,0.07142295278920126,wikipedia,180
https://linked4resilience.eu/data/cultural-sites/00019,Old church (Tserkva Heorhiyivsʹka) in Zavorychi village of Kyiv region,St. George's Church,"Kirova 57, Zavorychi, Brovary Raion, Kyiv Oblast, Ukraine.",2022-03-07,,https://uk.wikipedia.org/wiki/%D0%93%D0%B5%D0%BE%D1%80%D0%B3%D1%96%D1%97%D0%B2%D1%81%D1%8C%D0%BA%D0%B0_%D1%86%D0%B5%D1%80%D0%BA%D0%B2%D0%B0_(%D0%97%D0%B0%D0%B2%D0%BE%D1%80%D0%B8%D1%87%D1%96),https://www.ukrinform.ua/rubric-regions/3494326-rosiani-nisat-nasi-hrami-bo-ce-dla-nih-cuza-ne-ihna-zemla.html,Point (31.1509406217 50.7042498289),31.1509406217,50.7042498289,Kyiv Oblast,"50.7042498289,31.1509406217",Q111146564,Георгіївська церква (Заворичі),Q16970,церква,0.07142295278920126,wikipedia,180
